{
  "schema_version": "0.1",
  "goal_id": "2026-05-21-example-goal",
  "spec_path": ".claude/agentic/specs/2026-05-21-example-goal.md",
  "worktree_path": ".worktrees/goal-2026-05-21-example-goal",
  "baseline_ref": "abc1234",
  "head_ref": "def5678",
  "status": "complete",
  "started_at": "2026-05-21T10:05:00Z",
  "completed_at": "2026-05-21T10:42:00Z",
  "diff_stats": { "files_touched": 3, "lines_added": 42, "lines_removed": 0 },
  "tests": { "ran": 5, "passed": 5, "failed": 0, "skipped": 0, "logs_path": ".worktrees/goal-2026-05-21-example-goal/test-output.log" },
  "self_check": { "lint": "clean", "typecheck": "n/a" },
  "scope_check": { "in_spec_files": ["src/health.ts"], "out_of_spec_files": [] },
  "adrs_filed": [],
  "spec_change_requests": [],
  "deferrals": [],
  "clarifying_questions_asked": [],
  "artifacts": [],
  "commits": [
    { "sha": "def5678", "subject": "[2026-05-21-example-goal] add /health endpoint" }
  ]
}
